Processo;Beneficiario;ano_GD_ben;Titulo_Processo;Area;UF_ Destino;PQ;Ano Lattes;Papers ;Papers_no_tema;Livros;Livros_tema;Capitulos;Capítulos tema;IC;IC_tema;GM;GM_tema;GD;GD_tema;ultima_prod_tema;ultima_ orient_tema;Tese;Orientador;Producoes;Producoes_tema;Orientacoes;Orientacoes_tema ;IES_GD;IES_Vinculo;prod_Geral;prdo_Tema;orient_Geral;orient_Tema;Prod_total;Orient_total
403042/2005-4;Adelaine Laguardia Nogueira;2000;Genero e memoria cultural: a mulher e o sonho da Republica em periodicos do seculo XIX;Letras;MG;;2016;16;12;1;1;11;7;8;5;18;12;0;0;2016;2015;Fragmentos da Memória e Ruínas da História: uma leitura de Kazuo Ishiguro;Ana Lúcia Almeida Gazola;6;0;0;0;UFMG;UFSJ;28;20;26;17;34;17
403044/2005-7;Ana Cristina Ostermann;2000;Genero, sexualidade e violencia: uma investigacao sociolinguistica interacional dos atendimentos a saude da mulher;Lingüística;RS;PQ-1D;2018;33;11;7;4;27;13;25;15;17;3;6;1;2017;2014;Reifying and Defying Sisterhood: Communities of Practice at Work at an All-Female Police Station and a Feminist Crisis Intervention Center in Brazil; Deborah Keller-Cohen;11;3;1;0;University Of Michigan;UNISINOS;67;28;48;19;78;20
403061/2005-9;Ana Louise de Carvalho Fiúza;2001;Genero, pobreza, geracao de tecnologia e extensao rural.;Agronomia;MG;;2018;112;22;3;1;28;9;19;3;62;13;5;0;2016;2018; PAPEL DA MULHER RURAL NAS POLÍTICAS DE DESENVOLVIMENTO SUSTENTÁVEL;MARIA JOSÉ CARNEIRO;12;3;11;5;UFRRJ;UFV;143;32;86;16;155;27
403153/2005-0;Anna Paula Uziel;2002;Conjugalidade, parentalidade e trabalho na juventude: desafio de uma conjugacao;Psicologia;RJ;PQ-2;2018;23;21;5;4;16;14;17;15;22;15;7;7;2018;2018;Família e homossexualidade. Velhas questões, novos problemas;Mariza Corrêa;15;13;2;2;UNICAMP;UERJ;44;39;46;37;59;39
403038/2005-7;Berenice Bento;2003;Quem tem direito aos Direitos Humanos? Transexualidade e saude publica;Sociologia;DF;PQ-2;2018;38;29;15;14;29;29;13;11;10;8;2;2;2018;2018;A (re) invenção do corpo: sexualidade e gênero na experiência transexual;Deis Elucy Siqueira;7;7;0;0;UnB;UnB;82;72;25;21;89;21
402940/2005-9;Cassia Maria Carloto;2000;O Sistema Unico de Assistencia Social, Politica de Assistencia Social e a centralidade na familia: desafios, avancos e limites a autonomia das mulheres numa perspectiva de genero;Serviço Social;PR;;2018;20;16;4;4;8;6;6;4;21;7;2;0;2018;2018;Saúde da Mulher Trabalhadora:: Doenças Não Reconhecidas e Sofrimento;Regina Maria G. Marsiglia;9;9;5;4;PUC/SP;UEL;32;26;29;11;41;16
403253/2005-5;Debora Diniz;1999;Doze Mulheres e a Escolha pelo Aborto: um video etnografico;Saúde Coletiva;DF;;2018;106;45;35;6;53;25;44;24;28;15;12;6;2017;2017; Da Impossibilidade do Trágico: conflitos morais e bioética;Rita Laura Segato;79;30;15;3;UnB;UnB;194;76;84;45;273;60
402954/2005-0;Elaine Gleci Neuenfeldt;2004;ERRANCIAS E ITINERARIOS DA SEXUALIDADE, DOS DIREITOS REPRODUTIVOS E DO ABORTO - ABORDAGENS BIBLICO-TEOLOGICAS.;Teologia;RS;;2010;2;2;3;3;12;10;0;0;2;1;0;0;2008;2006;Praticas e experiencias religiosas de mulheres no antigo Israel.;Peter Theodore Nash;9;6;0;0;Instituto Ecumênico de Pós Graduação;Escola Superior de Teologia;17;15;2;1;26;1
403281/2005-9;Eliane Araújo de Oliveira;2002;Perfil de Qualidade de Vida em Mulheres Climatericas;Fisioterapia e Terapia Ocupacional;PB;;2018;21;9;1;0;17;5;38;26;0;0;1;1;2017;2017; Influencia de un programa de ejercicio físico en la calidad de vida de mujeres menopausicas;Maria del Carmen Villaverde Gutiérrez;1;0;1;1;Universidade de Granada;UFPB;39;14;39;27;40;28
403138/2005-1;Eliane Martins de Freitas;2005;Corpos Marcados: reflexoes sobre genero, violencia e direito das mulheres;História;GO;;2018;13;6;8;3;4;3;22;15;3;1;0;0;2017;2017;OS SIGNIFICADOS DA JUSTIÇA: justiça, violência e aplicação da lei em Goiás 1890-1941;Fernando Kolleritz;0;0;0;0; UNESP/FRANCA;UFG/Catalão;25;12;25;16;25;16
402932/2005-6;Elisa Guaraná de Castro;2005;"""As Jovens Rurais e a Reproducao Social das Hierarquias : relacoes de genero na construcao da categoria juventude rural em Movimentos Sociais no Brasil"".";Antropologia;RJ;;2018;4;0;4;0;19;3;9;1;5;2;3;0;2008;2013; Entre Ficar e Sair: uma etnografia da construção social da categoria jovem rural;Moacir Gracindo Soares Palmeira;6;0;0;0;UFRRJ;UFRRJ;27;3;17;3;33;3
403223/2005-9;Elisabete Stradiotto Siqueira;1999;A contribuicao da lideranca feminina para os processos de governanca corporativa no terceiro setor;Administração;SC;;2018;50;3;7;0;30;5;12;2;18;0;0;0;2014;2011; A produção da casa na construção do sonho: o papel das ONGs na gestão de recursos públicos/privados de habitação,;Maria de Lourdes Manzini Covre;25;0;16;0;PUC/SP;UFERSA;87;8;30;2;112;18
403272/2005-0;Enilce do Carmo Albergaria Rocha;2001;Diálogos e convergências na escrita de autoria feminina em paises da Africa e da diaspora africana no Brasil;Letras;MG;;2018;8;1;6;1;12;0;13;9;11;0;6;2;2013;2013;A utopia do diverso: o pensamento glissantiano nas escritas de Edouard Glissant e Mla Couto;Benjamin Abdala Júnior;3;0;2;1;USP;UFJF;26;2;30;11;29;13
403097/2005-3;Enilda Rosendo do Nascimento;2000;Genero, racismo e acesso/utilizacao de servicos de saude;Enfermagem;BA;;2017;29;23;1;1;5;4;13;13;11;11;1;1;2015;2014;ASSISTÊNCIA DE ENFERMAGEM NA PERSPECTIVA DE GÊNERO: Concepções de Mulheres em um Centro de Saúde de Salvador - Bahia;Lana Lage da Gama Lima;10;6;8;8;UFRJ;UFBA;35;28;25;25;45;33
403077/2005-2;Fernanda Marques de Queiroz;2005;Politicas publicas de prevencao e combate a violencia contra a mulher no Estado do Rio Grande do Norte;Serviço Social;RN;;2018;8;7;5;5;8;8;8;8;2;2;0;0;2018;2017;Rimando amor e dor: representações sociais sobre violência conjugal;Maria de Fátima de Sousa Santos;0;0;0;0;UFPE;UERN;21;20;10;10;21;10
402987/2005-5;Gema Galgani Silveira Leite Esmeraldo;2004;Cartografia de Lugares e Tempos Sexuados nos Assentamentos Rurais: Escavando Rupturas a Ordem Binaria;Economia Doméstica;CE;;2018;17;5;6;1;30;11;7;2;25;9;0;0;2018;2018;O MST sob o signo de uma economia subjetiva. O Assentamento José Lourenço;Daniel Soares Lins;0;0;0;0;UFC;UFC;53;17;32;11;53;11
403040/2005-1;Heloisa Buarque de Almeida;2001;De Mulher a Malu: genero nos seriados da TV brasileira;Antropologia;SP;PQ-2;2018;10;6;2;1;11;9;16;13;12;8;4;3;2017;2016;"""Muitas mais coisas"": telenovela, consumo e gênero";Guita Grin Debert;10;7;2;2;UNICAMP;USP;23;16;32;24;33;26
403177/2005-7;Inês Assunção de Castro Teixeira;1998;Mulheres e docencias nas Minas Gerais: genero, poder, tempo e historia;Educação;MG;PQ-2;2018;24;2;21;3;32;5;23;4;8;5;18;6;2018;2017;Tempos enredados: teias da condição professor;Miguel González Arroyo;23;7;19;1;UFMG;UFMG;77;10;49;15;100;34
403165/2005-9;Isabel Lausanne Fontgalland;1999;Consequencias recentes de um novo padrao de insercao das mulheres no mercado de trabalho formal sobre o bem-estar na regiao do agreste paraibano: a experiencia de Campina Grande;Economia;PB;;2018;1;1;3;1;1;0;10;4;1;0;0;0;2016;2010;Contribution a l'étude de la formation ouvrière dans un contexte d'organisation flexible: L'exemple des UET chez Renault;Alain Alcouffe;15;2;7;0;Université de Sciences Sociales de Toulouse 1;UFCG;5;2;11;4;20;11
403174/2005-8;Ivaine Maria Tonini;2002;Lugares de mulheres no mercado de trabalho em Fortaleza/Ce - sua configuracao pela midia;Geografia;RS;;2018;13;0;15;1;27;4;3;1;17;2;3;0;2017;2017;Identidades Capturadas - gênero, geração e etnia na hierarquia territorial dos livros didáticos de Geografia;Marisa Cristina Vorraber Costa;10;2;3;0;UFRGS;UFRGS;55;5;23;3;65;6
402935/2005-5;Jane Felipe Beltrão;1999;Sexualidade e Direitos Humanos: o dito por escrito na pratica juridica;Antropologia;PA;PQ-1C/ CA;2018;35;4;24;3;48;10;21;4;20;6;11;1;2017;2018;Cólera, o flagelo da Belém do Grão-Pará;Sidney Chalhoub;19;0;19;3;UNICAMP;UFPA;107;17;52;11;126;30
403263/2005-0;José Alcides Figueiredo Santos;2000;CLASSE SOCIAL, RACA E DESIGUALDADE DE GENERO NO BRASIL;Sociologia;MG;PQ-2;2018;20;4;0;0;13;0;20;5;30;2;2;0;2010;2016; Estrutura de Posições de Classe no Brasil: Mapeamento, Mudanças e Efeitos na Renda; Nelson do Valle Silva;6;0;0;0;IUPERJ;UFJF;33;4;52;7;39;7
403267/2005-6;Joseli Maria Silva;2002;FEMINIZACAO DAS PERIFERIAS POBRES: GENERO E SEXUALIDADE COMO ELEMENTOS PARA DESENVOLVIMENTO DE POLITICAS URBANAS CONTEMPORANEAS.;Geografia;PR;PQ-2;2018;61;48;9;8;34;30;21;15;18;12;5;5;2018;2018;A Verticalização de Guarapuava PR e Suas Representações Sociai;Roberto Lobato Corrêa;2;2;4;3;UFRJ;UEPG;104;86;44;32;106;36
403206/2005-7;Katia Regina Frizzo;2004;LAZER E RELACOES DE GENERO NO MEIO RURAL;Psicologia;SC;;2018;1;0;0;0;6;0;1;0;3;0;0;0;2005;; Conselho Tutelar e Comunidade: o impacto do conselho nas práticas sociais com crianças e adolescentes;Jorge Castellá Sarriera;0;0;0;0;PUC/RS;SV;7;0;4;0;7;0
403154/2005-7;Lady Selma Ferreira Albernaz;2004;Mulheres e cultura popular: genero, raca, classe e geracao no bumba meu boi do Maranhao;Antropologia;PE;;2018;11;3;3;3;11;6;9;6;19;11;3;2;2016;2018;"O ""urrou"" do boi em Atenas: instiuições, experiencias culturais e identidade no Maranhão";Suely Kofes;0;0;0;0;UNICAMP;UFPE;25;12;31;19;25;19
402981/2005-7;Laura Moutinho;2001;Raca, sexualidade, genero e saude em uma perspectiva comparada;Saúde Coletiva;RJ;PQ-1D;2018;14;6;7;5;8;4;20;12;10;7;4;1;2016;2016;"Razão, ""Cor"" e Desejo: uma Análise Comparativa sobre Relacionamentos Afetivos-Sexuais ""inter-raciais"" no Brasil e na África do Sul";Peter Henry Fry;19;10;5;5;UFRJ;USP;29;15;34;20;48;25
403080/2005-3;Lígia Albuquerque de Melo;2003;A Participacao da Mulher Agricultora Familiar no Credito do Pronaf B e Pronaf Mulher;Sociologia;PE;;2017;1;1;0;0;3;2;10;9;0;0;0;0;2015;2012;Relações de Gênero na Agricultura Familiar: o caso do Pronaf em Afogados da Ingazeira - PE;Russell Parry Scott;5;5;1;1;UFPE;FJN;4;3;10;9;9;10
402949/2005-6;Lourdes de Maria Leitão Nunes Rocha;2005;Mulheres, Organizacao e Mundo do Trabalho: processos de lutas e participacao;Serviço Social;MA;;2018;5;4;2;2;4;3;4;4;7;3;3;2;2017;2017;Violência de gênero e políticas públicas no Brasil: um estudo sobre as casas-abrigo para mulheres em situação de violência doméstica;Terezinha Moreira Lima;1;1;0;0;UFMA;UFMA;11;9;14;9;12;9
402964/2005-5;Ludmila Fontenele Cavalcanti;2004;AVALIACAO DOS NUCLEOS DE ATENCAO AS MULHERES EM SITUACAO DE VIOLENCIA SEXUAL NAS MATERNIDADES MUNICIPAIS DO RIO DE JANEIRO;Saúde Coletiva;RJ;;2018;15;14;6;1;18;14;22;22;8;6;2;1;2017;2018; Estudo das representações sociais na prevenção da violência sexual: assistência pré-natal no Município do Rio de Janeiro;Maria Cecília de Souza Minayo;2;2;5;5;FIOCRUZ;UFRJ;39;29;32;29;41;34
402937/2005-8;Luis Felipe Rios do Nascimento;2004;Pesquisa avaliativa das respostas relacionadas ao sexual, com atores de instituicoes governamentais responsaveis pela garantia dos direitos da crianca e do adolescente no Recife;Psicologia;PE;;2018;28;26;10;7;37;23;22;22;26;22;6;3;2018;2018;O Feitiço de Exu. Um estudo comparativo sobre parcerias e práticas homossexuais entre homens jovens candomblesistas e/ou integrantes da comunidade entendida do Rio de Janeiro;Richard Guy Parker;10;10;1;1;UERJ;UFPE;75;56;54;47;85;48
402953/2005-3;Luiz Mello de Almeida Neto;1999;Familia, genero e orientacao sexual - um estudo sobre relacoes afetivo-sexuais nao centradas na monogamia.;Sociologia;GO;;2018;20;18;4;3;6;4;2;2;7;6;0;0;2017;2011;Família no Brasil dos Anos 90: um estudo sobre a construção social da conjugalidade homossexual;Brasilmar Ferreira Nunes;9;8;4;3;UnB;UFG;30;25;9;8;39;12
403081/2005-0;Magda Eva Soares de Faria Wehrmann;2000;Genero e representacao social do desenvolvimento rural sustentavel;Sociologia;DF;;2013;2;0;0;0;8;0;0;0;3;0;3;0;;; A soja no cerrado de Roraima: um estudo da penetração da agricultura moderna em regiões de fronteira;Laura Maria Goulart Duarte;6;0;5;0;UnB;UnB;10;0;6;0;16;5
402974/2005-0;Márcia Ramos Arán;2001;Analise dos sistemas de sexo-genero nos discursos sobre Transexualidade nas praticas de saudede;Saúde Coletiva;RJ;;2010;15;13;1;1;3;3;0;0;6;3;2;1;2010;2010;O Avesso do Avesso: feminilidade e novas formas de subjetivação;Joel Birman;12;12;1;1;UERJ;UERJ;19;17;8;4;31;5
403127/2005-0;Marco Aurélio Máximo Prado;2000;Identidade Coletiva e Politica: Genero e Demandas Democraticas em Diferentes Experiencias de Mobilizacao Social;Psicologia;MG;PQ-2;2018;27;19;8;4;27;14;18;15;20;17;8;5;2018;2018;Des-razão: sujeitos da consciência e políticas de identificação. Um mapa teórico sobre o sujeito coletivo e o político na literatura acerca das ações coletivas;Salvador Antonio Meirelles Sandoval;12;1;9;5;PUC/SP;UFMG;62;37;46;37;74;46
403102/2005-7;Marcos Fábio Freire Montysuma;2003;Visoes de Genero na utilizacao dos recursos ambientais na Amazonia: uma ponte entre Acre e Tocantins(1964-2006);História;SC;;2018;5;1;3;1;17;7;3;0;8;2;19;2;2014;2015;Senhores das Matas: Expeirências Extrativistas na RESEX Chico Mendes (1983/2002);Maria Antonieta Matinez Antonacci;2;0;0;0;PUC/SP;UFSC;25;9;30;4;27;4
403221/2005-6;Marga Janete Ströher;2002;O papel da religiao e do discurso religioso na producao e na reproducao da violencia sexista e a desconstrucao do discurso e dos simbolos religiosos para a superacao da violencia;Teologia;RS;;2014;3;0;3;0;4;3;0;0;8;3;0;0;2008;2009; Caminhos de resistência nas fronteiras do poder normativo - Um Estudo das Cartas Pastorais em perspectiva feminista;Uwe Wegner;7;4;0;0;EST;DSH/PR;10;3;8;3;17;3
403054/2005-2;Maria Angela de Faria Grillo;2005;As amas-de-leite entre a casa e a rua: trabalho feminino e maternidade no Recife (1870-1880);História;PE;;2018;4;1;4;1;9;3;9;1;10;1;0;0;2007;2013;A Arte do Povo:histórias na literatura do cordel (1900/1940);Rachel Soihet;1;1;1;0;UFF;UFRPE;17;5;19;2;18;3
403239/2005-2;Maria Antônia Cardoso Nascimento;2000;Familia, genero e prostituicao: entre a modernizacao e permanencia de estruturas de poder na Amazonia.;Serviço Social;PA;;2018;8;4;3;0;9;0;7;4;23;13;1;0;2016;2017;Crianças e Adolescentes: imbricamento classe-raça-etnia-gênero nos programas sociais em Belém;Dilsea Bonetti;5;3;7;2;PUC/SP;UFPA;20;4;31;17;25;24
403176/2005-0;Maria do Rosario de Fátima Andrade Leitão;1998;CONFLITOS DE GENERO NO COTIDIANO DA COMUNIDADE COSTEIRA: A VER- O- MAR;Sociologia;PE;;2018;12;6;8;5;33;20;12;10;17;6;1;1;2017;2014;Movimiento Obrero en Pernambuco - 1930 -1945;José Luis Rubio Cordón;8;0;7;0;Universidad Complutense de Madrid;UFRPE;53;31;30;17;61;24
401880/2005-2;Maria Helena Braga e Vaz da Costa;2000;A MULHER, O ESPACO URBANO E O CINEMA;Artes;RN;PQ-2;2018;40;2;3;0;14;0;35;4;14;0;1;0;2009;2008;Cities in Motion: Towards an Understanding of the Cinematc Cit;Simon Rycroft;15;0;8;1;University of Sussex;UFRN;57;2;50;4;72;12
403029/2005-8;Maria Helena de Paula Frota;2000;O femicidio no Ceara: machismo e impunidade?;Sociologia;CE;;2018;12;11;13;11;3;3;11;1;43;29;0;0;2017;2017; Las Castañeras: el proceso de socialización del trabajo femenino en la industria de la castaña en Ceará - Brasil; Mariano Fernández Enguita;11;8;8;4;Universidad de Salamanca;UECE;28;25;54;30;39;38
403091/2005-5;Maria Ignez Costa Moreira;2001;Solidariedade e Conflito: Relacoes Intergeracionais entre pais e filhos jovens;Psicologia;MG;;2018;22;12;8;3;42;18;6;0;28;9;4;2;2018;2018;Gravidez na Adolescência: Análise das Significações Construídas ao longo de gerações de mulheres;Silvia Tatiana Maurer Lane;8;5;5;1;PUC/SP;PUC/MG;72;33;38;11;80;16
403015/2005-7;Maria Inês Couto de Oliveira;2001;Genero, Poder e Cidadania: a mulher e sujeito no processo decisorio da amamentacao ao nascimento quando o status de HIV e ignorado pelo servico?;Saúde Coletiva;RJ;;2018;35;4;1;0;5;0;8;1;21;1;3;1;2015;2015;Promoção, proteção e apoio à amamentação na atenção básica à saúde: bases teóricas e metodologia de avaliação;Luiz Antonio Bastos Camacho;0;0;0;0;FIOCRUZ;UFF;41;4;32;3;41;3
403013/2005-4;Maria Ivonete Barbosa Tamboril;2005;Mulheres camponesas nos movimentos social e sindical do campo;Psicologia;RO;;2017;3;1;3;0;9;2;11;11;10;2;0;0;2014;2017;Políticas públicas para a formação docente: um estudo em Porto Velho-RO;Lino de Macedo;1;0;0;0;USP;UNIR;15;3;21;13;16;13
401865/2005-3;Maria Lucia da Silveira;1999;Politicas Publicas de Igualdade de Oportunidades: A insercao de politicas de genero em tres metropolis da America Latina;Sociologia;SP;;2012;0;0;0;0;3;3;0;0;0;0;0;0;2008;2005;Itinerários de Gênero eRe-significação da cidadania;Leila Maria da Silva Blass;6;6;2;2;PUC/SP;Pref.Mun.SP;3;3;0;0;9;2
403224/2005-5;Maria Luzia Miranda Álvares;2004;Genero, Politica e Representacoes Sociais;Ciência Política;PA;;2018;12;12;5;3;13;12;9;3;1;1;0;0;2014;2015;Mulheres na competição eleitoral. Seleção de candidaturas e padrão de carreira política no Brasil;Jairo Marconi Nicolau;1;1;0;0;IUPERJ;UFPA;30;27;10;4;31;4
403104/2005-0;Mário José Filho;1998;Os papeis exercidos pelos homens nas familias incluidas no PETI formadas ha mais de quatro anos.;Serviço Social;SP;;2011;8;1;4;0;10;0;8;5;4;1;6;2;2006;2008; A Família como espaço privilegiado para a construção da cidadania;Maria Lúcia Martinelli;25;2;28;6;UNESP;UNESP;22;1;18;8;47;36
402941/2005-5;Marlene de Fáveri;2002;Grupos  populares e equidade de genero: um estudo  sobre relacoes de genero na Educacao de Jovens e Adultos em Florianopolis;Educação;SC;;2018;18;9;3;3;10;8;7;5;12;8;0;0;2016;2017; Memórias de uma (outra) guerra: cotidiano e medo durante a Segunda Guerra em Santa Catarina;Joana Maria Pedro;9;2;3;0;UFSC;UDESC;31;20;19;13;40;16
403248/2005-1;Marlene Teixeira Rodrigues;2003;Possibilidades e limites da incorporacao da transversalidade de genero pelas politicas sociais: uma analise a partir da insercao do Servico Social;Serviço Social;DF;;2018;3;2;5;1;10;10;22;22;9;5;2;1;2015;2016;POLÍCIA E PROSTITUIÇÃO FEMININA EM BRASÍLIA - UM ESTUDO DE CASO;Lourdes Maria Bandeira;2;1;0;0;UnB;UnB;18;13;33;28;20;28
402945/2005-0;Marli Lúcia Tonatto Zibetti;2005;Mulheres e professoras: implicacoes da condicao feminina no magisterio publico municipal em Rondonia;Educação;RO;;2018;28;6;6;0;20;4;16;3;14;1;0;0;2018;2018;Os saberes docentes na prática de uma alfabetizadora: um estudo etnográfico;Marilene Proença Rebello de Souza;2;2;0;0;USP;UNIR;54;10;30;4;56;4
403136/2005-9;Marlise Miriam de Matos Almeida;1998;A POLITICA NA AUSENCIA DAS MULHERES: UM ESTUDO SOBRE RECRUTAMENTO POLITICO, TRAJETORIAS/CARREIRAS E COMPORTAMENTO LEGISLATIVO DE MULHERES;Ciência Política;MG;PQ-2;2018;18;18;6;6;43;32;14;14;12;8;7;6;2018;2017;Reinvenções do Vínculo Amoroso: cultura e identidade de gênero na modernidade tardia;Neuma Aguiar e Luís Eduardo Soares;9;9;2;1;IUPERJ;UFMG;67;56;33;28;76;30
402926/2005-6;Marta Mega de Andrade;2000;O Espaco Publico e a Construcao do Genero: contextos funerarios e exposicao feminina na Atenas Classica;História;RJ;PQ-2;2018;10;4;2;2;7;5;10;9;8;3;2;1;2014;2016;"A Vida Comum"": espaço, cotidiano e representações urbanas na Atenas Clássica";Ulpiano Toledo Bezerra de Meneses;10;2;7;4;USP;UFRJ;19;11;20;13;29;20
403268/2005-2;Monica Aparecida Del Rio Benevenuto;2003;"""MULHER E TERRA: REPENSANDO O LUGAR SOCIAL DA MULHER RURAL SOB A OTICA DAS RELACOES DE GENERO E INTERGERACIONAL""";Economia Doméstica;RJ;;2018;1;0;2;1;7;2;5;4;4;0;0;0;2016;2013;Aparência e estilo como elementos de análise da expressão de juventude do Assentamento rural de Casas Altas-RJ;Silvana Gonçalves de Paula;1;0;3;2;UFRRJ;UFRRJ;10;3;9;4;11;7
402997/2005-0;Mozar José de Brito;2000;Relacoes de Poder, Genero e Violencia no Espaco Organizacional: Uma Abordagem  Construcionista;Administração;MG;PQ-1B /CA;2018;92;3;1;0;2;1;3;1;25;1;9;1;2014;2012;Mudança e cultura organizacional: A construção social de um novo modelo de gestão de P&D na EMBRAPA;Maria Tereza Leme Fleury;24;9;13;2;USP;UFLA;95;4;37;3;119;16
402960/2005-0;Najara Ferrari Pinheiro;2004;Corpo na TV: estrategias verbais e nao-verbais de representacao de genero  no discurso dos magazines femininos televisivos;Comunicação;RS;;2018;19;8;6;0;8;0;23;11;1;0;0;0;2010;2010;A marquetização no discurso dos magazines femininos televisuais;Ronaldo Cesar Henn;3;0;1;1;UNISINOS;Universidade Franciscana;33;8;24;11;36;12
402912/2005-5;Nara Martini Bigolin;1999;Utilizacao do Processo de Descoberta de Conhecimento para Estabelecer o Perfil da Mulher como Consumidora de Servicos;Ciência da Computação;RS;;2018;3;0;0;0;1;0;0;0;0;0;0;0;;;Descoberta de Conhecimento em Banco de Dados Geográficos e Orientado a Objeto;Anne Doucet;5;0;2;0;Université Pierre et Marie Curie, LISE / CNRS, França;UFSM;4;0;0;0;9;2
402976/2005-3;Neuza Maria de Fátima Guareschi;1998;Planejamento Familiar e Aborto: problematizando as politicas publicas de Saude da Mulher;Psicologia;RS;PQ-1C;2018;89;5;14;0;49;2;24;3;17;3;21;4;2017;2011; The Favela and the School: contraditions and resistence in students'constructions of identities;Michael Apple;49;14;43;8;" 
University of Wisconsin";UFRGS;152;7;62;10;201;53
403214/2005-0;Patrícia Fernanda GOUVEIA DA SILVA;2003;'AS NOVAS ECONOMISTAS DOMESTICAS DO DED/UFV/MG: EXTENSAO UNIVERSITARIA, DISPOSICAO PROFISSIONAL E CONFIGURACOES IDENTITARIAS ';Economia Doméstica;MG;;2017;9;4;1;0;7;2;4;3;10;5;0;0;2010;2008;Mulheres - comunitárias, personae - viajantes. Classe, gênero, identidade e participação popular; Regina Celia Reyes Novaes;4;1;4;2;UFRJ;UFV;17;6;14;8;21;12
403101/2005-0;Rita de Lourdes de Lima;2005;O papel das mulheres na historia do Departamento de Servico Social em Natal - RN;Serviço Social;RN;PQ-2;2018;14;8;2;2;2;2;18;6;19;11;0;0;2017;2018;"Os Assistentes Sociais e a questão da subalternidade profissional: reflexões acerca das representaçõe sociais do ""Ser Mulher"" e do Serviço Social";Maria de Fátima de Souza Santos;0;0;2;0;UFPE;UFRN;18;12;37;17;18;19
403246/2005-9;Rosane Silva Pinto de Mendonça;2000;INVESTIMENTO EM CAPITAL HUMANO DA MULHER COMO ESTRATEGIA DE COMBATE A POBREZA E A DESIGUALDADE;Economia;RJ;;2010;4;0;0;0;8;0;1;0;3;0;1;0;1998;;A Oportunidade Imperdível: Expansão Educacional e Desenvolvimento Humano no Brasil;Ricardo Paes de Barros;20;0;0;0;UFRJ;UFF;12;0;5;0;32;0
403172/2005-5;Rosângela Saldanha Pereira;2002;O Desafio da Transversalidade e Equidade de Genero e Raca nas Politicas Publicas: Estudo do Orcamento do Municipio de Cuiaba no Ano de 2005.;Economia;MT;;2017;10;3;0;0;3;1;1;0;0;0;0;0;2015;2009;Conexão entre desigualdade de renda, educação e mercado de trabalho: o caso de Mato Grosso na década de 90; Edson Pacheco de Almeida;4;1;3;0;UFMT;UFMT;13;4;1;0;17;3
402979/2005-2;Rosineide de Lourdes Meira Cordeiro;2004;As agricultoras e a Previdencia Social  no Sertao de Pernambuco;Serviço Social;PE;;2018;22;13;7;6;26;18;18;17;24;15;2;2;2016;2017;Além das secas e das chuvas: os usos da nomeação mulher trabalhadora rural no Sertão de Pernambuco;Mary Jane Spink;1;1;1;1;PUC/SP;UFPE;55;37;44;34;56;35
403089/2005-0;Ruth Sabat;2003;Discursos jovens e a producao performativa de genero e sexualidade;Educação;RS;;2014;1;0;0;0;7;5;0;0;0;0;0;0;2013;2011; Filmes Infantis e a Produção Performativa da Heterossexualidade;Guacira Lopes Louro;6;6;1;1;UFRGS;UFRGS;8;5;0;0;14;1
402975/2005-7;Salete Oro Boff;2005;As discriminacoes de genero no Poder Judiciario;Direito;RS;;2018;65;0;33;1;78;1;12;0;18;0;4;1;2011;2015; BIOÉTICA, BIOTECNOLOGIA E PATENTES DE GENES: PERSPECTIVAS ÉTICAS E JURÍDICAS;VICENTE DE PAULO BARRETTO;4;1;0;0;UNISINOS;"
FACULDADE MERIDIONAL";176;2;34;1;180;1
403100/2005-4;Sissi Aparecida Martins Pereira;2004;Estereotipo e Identidade de Genero no Cotidiano Escolar;Educação Física;RJ;;2018;3;1;2;0;6;2;11;8;1;0;0;0;2010;2013;O sexismo nas aulas de Educação Física: uma análise dos desenhos infantis e dos estereótipos de gênero nos jogos e brincadeiras;Ludmila Mourão;2;2;1;1;UGF;UFRRJ;11;3;12;8;13;9
403142/2005-9;Stella Maria Poletti Simionato Tozo;2002;As redes sociais de apoio: uma comparacao entre familias nucleares e familias chefiadas por mulheres.;Psicologia;MG;;2016;1;1;0;0;0;0;6;4;0;0;0;0;2006;2007;O ciclo de vida familiar: um estudo transgeracional; Zélia Maria Mendes Biasoli-Alves;0;0;0;0;USP;PUC/MG;1;1;6;4;1;4
403010/2005-5;Teresa Cristina de Novaes Marques;2003;Sistema de heranca em familias de grandes comerciantes na Bahia colonial;História;DF;;2018;19;8;4;3;4;3;22;12;6;3;0;0;2018;2018;Capital, cerveja e consumo de massa: a trajetória da Brahma, 1888-1933;Elizabeth Cancelli;7;3;0;0;UnB;UnB;27;14;28;15;34;15
402918/2005-3;Teresa Kleba Lisboa;1999;Indicadores de equidade de genero nas politicas publicas - apontando possibilidades de empoderamento para mulheres;Serviço Social;SC;;2018;18;15;4;4;5;4;1;1;7;6;3;2;2017;2017;Heroínas em luta na conquista de suas glórias;Maria Susana Arrosa Soares;8;8;4;3;UFRGS;UFSC;27;23;11;9;35;13
402947/2005-3;Teresinha Maria Duarte;2004;AS RELACOES DE GENERO NA IGREJA CATOLICA: Um estudo do Instituto das Irmas Catequistas de N. Sra. da Visitacao;História;GO;;2018;12;4;3;1;4;2;31;10;3;0;0;0;2016;2016;OS FRANCISCANOS EM PORTUGAL (1214-1336);MARIA EURYDICE DE BARROS RIBEIRO;4;0;3;3;UnB;UFG/Catalão;19;7;34;10;23;13
402936/2005-1;Terezinha de Freitas Ferreira;2003;Sexualidade feminina na fronteira: Brasil, Peru e Bolivia;Enfermagem;AC;;2014;5;4;1;0;1;1;0;0;1;0;0;0;2009;;Um Estudo Etnográfico da Vivência da Mulher na Pós-menopausa;Rosalina Aparecida Partezani Rodrigues;3;3;0;0;USP;UFAC;7;5;1;0;10;0
403249/2005-8;Vera Lúcia Puga;1998;A corrida contra o tempo perdido: onde estao e o que fazem os idosos em Uberlandia no inicio do seculo  XXI;Saúde Coletiva;MG;;2018;6;5;8;7;7;6;0;0;7;6;7;6;2018;2016; Paixão, sedução e violência, 1960-1980;Eni de Mesquita Samara;11;9;13;5;USP;UFU;21;18;14;12;32;25
403085/2005-5;Violante Augusta Batista Braga;1998;GENERO E SAUDE MENTAL: A MULHER COM FOCO DE INVESTIGACAO E INTERVENCAO;Enfermagem;CE;;2015;64;11;1;0;6;1;12;6;8;0;8;4;2012;2014;O ENSINO DE ENFERMAGEM PSIQUIÁTRICA NO CEARÁ E A REFORMA PSIQUIÁTRICA: AVANÇOS E RECUOS;GRACIETTE BORGES DA SILVA;35;0;16;0;USP;UFC;71;12;28;10;106;26
